Job Position;Company;Location;Salary;Job Type;Days_Since_Posted;Link;Description
Data Analyst;WINOD RITEL INDONESIA;Karang Tengah, Banten;Rp 4.500.000 – Rp 5.500.000 per month;Full time;6;https://www.jobstreet.co.id/id/job/85109636?type=standard&ref=search-standalone&origin=jobCard#sol=ad57dfbab9ab5cdd607ce11a34ecf279799c5cb9;"Gambaran Umum Pekerjaan :
Memahami dengan baik sistem database produk-produk perusahaan.
Memelihara sistem database perusahaan.
Berkolaborasi dengan Head Store untuk memperoleh data yang dibutuhkan perusahaan.
Mengatur data yang diperoleh untuk dikelola sesuai jenis datanya.
Mempresentasikan data yang telah diproses dalam sebuah rapat untuk dijelaskan kepada seluruh tim tentang data yang ada sehingga bisa digunakan sesuai kebutuhan
Merancang dan mengimplementasikan database, sistem pengumpulan data, analisis data, dan strategi lainnya dengan tujuan meningkatkan efisiensi dan kualitas statistik. 
Menganalisis, mengevaluasi, dan memahami tren atau pola dalam kumpulan data yang kompleks
Melakukan kerjasama dengan manajemen dalam menetapkan prioritas kebutuhan bisnis dan informasi.
Kualifikasi :
Usia maks.35 Tahun
Berpengalaman sebagai Data Analyst min. 1 tahun (Industri Retail lebih disukai)
Pendidikan D3/D4/S1 Jurusan Bisnis, Keuangan, atau lainnya yang sesuai
Menguasai rumus Microsoft Excel (wajib)
Memiliki skill problem-solving
Responsif dan komunikatif
Teliti dan rapi
Dapat berbahasa Indonesia dengan fasih
Bertanggungjawab, jujur, dan disiplin
Mampu bekerja dibawah tekanan
Memiliki kemampuan dan keterampilan analitis yang kuat dalam mempelajari fungsi bisnis dengan kemampuan untuk mengumpulkan, mengatur, menganalisis, mengevaluasi kebutuhan bisnis, dan menyebarkan informasi memperhatikan detail dan akurasi."
Research Analyst;PT Katadata Indonesia;Jakarta Selatan, Jakarta Raya;N/A;Full time;4;https://www.jobstreet.co.id/id/job/84895674?type=standard&ref=search-standalone&origin=jobCard#sol=b8551e7300034431c6b8050af0f4561ea75007d6;"Katadata Insight Center (KIC) is a business unit of Katadata, specialized in research and data analytic, providing in-depth insight. To support our expanding operations, we are currently seeking professional and dynamic individual to join our team with the following qualifications:
Bachelor's or Master's degree in Political Economy, Public Policy, Development Studies, or related fields in Social Sciences.
Minimum 2 years of experience as an analyst or researcher, with strong experience in qualitative and quantitative research.
Possess in-depth knowledge and experience of quantitative and qualitative research methodologies and strong data analysis skills.
Experience in producing research outputs such as research reports, white papers, policy briefs, and other formats.
Proficiency in quantitative or qualitative data analysis software, such as NVivo, SPSS, R, etc. is a plus.
Possess critical thinking, problem-solving, and results-oriented skills.
Possess excellent communication and presentation skills, both in Bahasa Indonesia and English.
Possess an understanding of business and economic issues, as well as a strong interest in social, economic, political and development issues including sectoral industrial issues (i.e. digital, finance, energy, etc.) in Indonesia and internationally.
Possess integrity, objectivity, and commitment to research quality.
Responsibilities:
Design and execute end-to-end research projects, from proposal development, methodology determination, data collection and analysis, to report preparation and presentation.
Conduct qualitative and quantitative research to generate relevant and actionable insights for clients.
Evaluate and develop research methodologies to improve research quality and effectiveness.
Manage relationships with clients and other stakeholders to ensure smooth research project execution.
Publish research findings in the form of reports, articles, or presentations on various platforms.
Collaborate with the research team to produce innovative and impactful research."
Analyst Programmer (System Analyst);PT Solusi Pembayaran Elektronik;Tangerang, Banten;Rp 9.000.000 – Rp 13.500.000 per month;Full time;0;https://www.jobstreet.co.id/id/job/85246745?type=standard&ref=search-standalone&origin=jobCard#sol=e015a056e279ece71298dbf3262b5e9ccc44baa2;"Job Desciption:
Memiliki pengalaman sebagai Sistem Analis selama 3-5 tahun dan menguasai Software Engineer selama 2-3 Tahun
Mengumpulkan dan menyempurnakan persyaratan secara independen untuk memenuhi kebutuhan bisnis, memastikan keselarasan pemangku kepentingan di seluruh siklus hidup proyek 
Mengembangkan desain sistem, memenuhi semua persyaratan yang dikumpulkan untuk memenuhi semua tujuan atribut kualitas dan atau peta jalan produk teknis. 
Menetapkan kerangka kerja yang komprehensif dengan mendefinisikan dan mempertahankan atribut kualitas, melakukan perencanaan kapasitas, dan menetapkan batasan sistem untuk mengoptimalkan sumber daya dan memastikan semua hasil proyek memenuhi tolok ukur dan melampaui harapan pemangku kepentingan. 
Mengembangkan dan memelihara Catatan Keputusan Arsitektur (ADR) untuk memandu dan mendokumentasikan keputusan teknis utama. 
Melakukan Analisis Akar Penyebab (RCAD) untuk mengidentifikasi masalah sistem, menerapkan solusi praktik terbaik, dan mendokumentasikan pelajaran yang dipetik. 
Berkolaborasi dengan tim lain untuk memanfaatkan tren yang muncul dan praktik terbaik untuk menjunjung tinggi standar kualitas dalam implementasi sistem. 
Requirements:
Memahami konsep dan arsitektur Microservices.
Memahami konsep manajemen Database SQL (MySQL, PostgreSQL) termasuk replikasi dan data partitioning.
Memahami struktur database fundamental (MySQL dan MongoDB) serta fungsi tipe data.
Mampu membuat dokumentasi teknis berupa TSD
Mampu membuat spesifikasi Restful API berdasarkan sistem berjalan serta mentransformasikan kebutuhan bisnis menjadi dokumentasi API.
Mampu menyusun response code Restful API yang memenuhi kebutuhan kondisi sistem.
Memahami konsep dan konfigurasi Database SQL (MySQL, PostgreSQL) serta Database NoSQL (MongoDB) dengan pengaturan setting sesuai kebutuhan produk/bisnis.
Memahami penggunaan AMQP (RabbitMQ) untuk message broker.
Mampu membuat dokumentasi Open API untuk pengembangan dan mocking API (format JSON/YAML).
Memiliki dasar penggunaan Docker untuk containerisasi"
Data Analyst & AI Automation Wizard;Investland Bali Properties;Bali;Rp 6.000.000 – Rp 9.000.000 per month;Full time;22;https://www.jobstreet.co.id/id/job/84762976?type=standard&ref=search-standalone&origin=jobCard#sol=2ac5bc784d301330bc0834e6263b64476913abf6;"Are you obsessed with numbers, patterns, and turning raw data into insights? We’re looking for a data-obsessed analytical thinker to help us build the most transparent, fact-driven real estate platform in Bali. Your mission: start by organizing and automating our monthly stats (tourism, property prices, investment, etc.), then help us scale to advanced analytics, smart automations, and deep data insights as we grow.
What You’ll Do
    Collect and organize key monthly stats (tourism, property, listings, investment) from internal and external sources
    Maintain and improve our reporting Google Sheets
    Help automate data collection using tools like Make.com, Zapier, APIs, or web scraping
    Design dashboards, infographics, and reports for internal teams and clients
    Analyze trends, spot insights, and help shape our monthly newsletters and investor updates
    As you grow: Own advanced analytics, reporting automations, and deep-dive market research projects
What We’re Looking For
    You love working with numbers and making sense of raw data
    Are up to date with newest AI possibilities and eager to learn
    Proficient with Google Sheets/Excel; bonus points for Notion, BI tools, or database software
    Strong analytical and problem-solving skills
    Ability to communicate insights simply—charts, visuals, and clear reports
    English and Indonesian (or other language) skills are a plus
    Self-driven, reliable, and detail-oriented—you enjoy building new systems and making things better!
Nice to Have (But Not Required)
    Experience in real estate, tourism, or finance
    SQL, Python, or other data tools
    Familiarity with Looker Studio (Google Data Studio), PowerBI, Tableau, or similar tools
    Previous work with APIs or web scraping
What We Offer
 
Ownership
: Opportunity to build something new from the ground up—own your processes
 
Growth
: Start with reporting, scale into data science/automation as we grow
 
Impact
: Work directly with founders and senior management
 
Flexibility
: Work from our Bali HQ or remotely
 
Benefits
: Competitive salary, learning budget, and travel opportunities
Ready to join Bali’s most innovative real estate team?
Apply here and write a Cover Letter why you would be THE BEST FIT for our company.
Let’s build something exceptional—together."
Data Analyst;WINOD RITEL INDONESIA;Karang Tengah, Banten;Rp 4.500.000 – Rp 5.500.000 per month;Full time;6;https://www.jobstreet.co.id/id/job/85109636?type=standard&ref=search-standalone&origin=jobCard#sol=84270827702015af08d12c68b3bc465e2f0a3403;"Gambaran Umum Pekerjaan :
Memahami dengan baik sistem database produk-produk perusahaan.
Memelihara sistem database perusahaan.
Berkolaborasi dengan Head Store untuk memperoleh data yang dibutuhkan perusahaan.
Mengatur data yang diperoleh untuk dikelola sesuai jenis datanya.
Mempresentasikan data yang telah diproses dalam sebuah rapat untuk dijelaskan kepada seluruh tim tentang data yang ada sehingga bisa digunakan sesuai kebutuhan
Merancang dan mengimplementasikan database, sistem pengumpulan data, analisis data, dan strategi lainnya dengan tujuan meningkatkan efisiensi dan kualitas statistik. 
Menganalisis, mengevaluasi, dan memahami tren atau pola dalam kumpulan data yang kompleks
Melakukan kerjasama dengan manajemen dalam menetapkan prioritas kebutuhan bisnis dan informasi.
Kualifikasi :
Usia maks.35 Tahun
Berpengalaman sebagai Data Analyst min. 1 tahun (Industri Retail lebih disukai)
Pendidikan D3/D4/S1 Jurusan Bisnis, Keuangan, atau lainnya yang sesuai
Menguasai rumus Microsoft Excel (wajib)
Memiliki skill problem-solving
Responsif dan komunikatif
Teliti dan rapi
Dapat berbahasa Indonesia dengan fasih
Bertanggungjawab, jujur, dan disiplin
Mampu bekerja dibawah tekanan
Memiliki kemampuan dan keterampilan analitis yang kuat dalam mempelajari fungsi bisnis dengan kemampuan untuk mengumpulkan, mengatur, menganalisis, mengevaluasi kebutuhan bisnis, dan menyebarkan informasi memperhatikan detail dan akurasi."
Data Analyst;PT Propan Raya Industrial Coating Chemicals;Tangerang, Banten;N/A;Full time;6;https://www.jobstreet.co.id/id/job/85102118?type=standard&ref=search-standalone&origin=jobCard#sol=f426e31e0d378cb09e763d26b05d699120c15d03;"Job Description:
Menganalisis data untuk mengidentifikasi tren, korelasi, dan insight bisnis
Mengembangkan laporan, visualisasi data, dan dashboard interaktif
Memberikan rekomendasi berbasis data kepada stakeholder terkait
Berkolaborasi dengan tim lintas fungsi untuk memahami kebutuhan analitik
Requirements:
Lulusan S1 Statistika, Matematika, atau Akuntansi
Menguasai Microsoft Excel secara mendalam (termasuk fungsi lanjutan dan analisis data)
Kemampuan komunikasi dan kolaborasi yang solid
Adaptif dalam kerja individu maupun tim
Pengalaman 1–2 tahun sebagai Data Analyst dengan pemahaman analitik yang kuat"
Inventory Data Analyst;CV.DINAMIKA ARTHA PERSADA;Medan, Sumatera Utara;Rp 5.000.000 – Rp 7.000.000 per month;Full time;7;https://www.jobstreet.co.id/id/job/85092389?type=standard&ref=search-standalone&origin=jobCard#sol=6789a1c3620979dce139ec3c3e6b72044bcb2dde;"Persyaratan :
Pendidikan Minimal S1 Jurusan Statistika, Matematika, Fisika, Teknik Informatika atau bidang terkait.
Pengalaman minimal 2 tahun di bidang Data Analyst / Data Administrator.
Diutamakan kandidat yang memiliki pengalaman di bidang Inventory atau Supply Chain.
Mahir menggunakan Microsoft Excel, khususnya dalam pengolahan data dalam jumlah besar.
Mampu memvisualisasi data dengan tools Power Bi / Tableau (menjadi nilai tambah).
Berdomisili dan penempatan di Kota Medan.
Bersedia dilakukan background checking.
Tugas dan Tanggung Jawab :
Menganalisa kebutuhan inventory di setiap cabang dan memberikan rekomendasi pemesanan barang yang optimal.
Menyediakan laporan kepada cabang terkait barang yang slow moving, mendekati kedaluwarsa (expired), atau mengalami kelebihan stok (overstock) untuk ditindaklanjuti.
Memantau pergerakan barang antar gudang dan cabang, serta melaporkan setiap ketidaksesuaian yang ditemukan."
DATA ANALYST STAFF;PT Industri Jamu Dan Farmasi Sido Muncul, Tbk;Cilandak, Jakarta Raya;N/A;Full time;27;https://www.jobstreet.co.id/id/job/84634647?type=standard&ref=search-standalone&origin=jobCard#sol=0593050a48b5a686bc9a9434fe642bd73e1b669d;"DATA ANALYST STAFF
 
Kualifikasi :
Minimal lulusan S1 atau sederajat Statistika, Matematika, IT atau yang setara
Memiliki pengalaman min. 2 tahun (pernah bekerja di Perusahaan FMCG menjadi nilai plus)
Memiliki pengalaman atau spesialisasi dalam sistem / database dan administrasi
Memiliki keterampilan Ms. Office (terutama Excel dan menguasai VBA lebih disukai)
Proaktif dan mampu bekerja secara individu maupun dalam tim
Berpikir kritis dan analitis
Memiliki kemampuan komunikasi dan presentasi yang baik
Hari Kerja Senin - Sabtu
 
Tanggung jawab kerja:
Melakukan analisa dari data marketing campaign
Mengelola data penjualan sebagai dasar penentuan keputusan
Membuat laporan penjualan untuk dilaporkan secara periodik 
Membuat dan memperbarui laporan kegiatan marketing terkini
Berkoordinasi dengan pihak-pihak terkait mengenai pengolahan dan penggunaan data
Memonitor laporan secara berkala"
Senior Data Analytics;PT Adecco Personnel Indonesia;Jakarta Raya;N/A;Full time;7;https://www.jobstreet.co.id/id/job/85093632?type=standard&ref=search-standalone&origin=jobCard#sol=b5d406b3076a9f9bcdb2e6bab94479eed9f72c9b;"Senior Data Analytics - Banking Company. 
Working Location : Jakarta - Head Office. 
We are looking for a seasoned Senior Data Analyst or Data Scientist with proven experience in the lending domain, particularly in analyzing various lending products such as personal loans, credit cards, BNPL, or SME financing. The ideal candidate should have some understanding of the lending lifecycle, with hands-on experience in areas such as credit risk assessment, loan performance analysis, underwriting strategies, collections optimization or any related project.
In addition, the candidate should be proficient in delivering insights across the full spectrum of analytics:
- Descriptive
- Diagnostic
- Predictive
- Prescriptive"
Data Support (Medan);PT Depoguna Bangunan Online;Medan, Sumatera Utara;N/A;Full time;18;https://www.jobstreet.co.id/id/job/84867517?type=standard&ref=search-standalone&origin=jobCard#sol=af7858ada77f52c10fa18aeb64497bd729431d5c;"Kualifikasi:
Berpengalaman min. 2 th di bidang Project support, terbiasa memahami proses yang berjalan.
Berpengalaman melakukan support pelaksanaan project mulai dari data setting, mapping data, pengecekan integrasi data ke system sampai dengan sosialisasi event terlaksana.
Berpengalaman dalam menangani masalah dan perubahan-perubahan yang terkait dengan aktivitasnya secara tepat sehingga isu-isu yang ada tersebut dapat terselesaikan.
Berpengalaman dalam melakukan monitoring terhadap fitur/proses yang berjalan pada project.
Terbiasa dalam menyediakan laporan-laporan terkait yang dibutuhkan oleh manajemen."
SOC Analyst Level 2;PT Sigma Cipta Utama;Jakarta Raya;N/A;Full time;0;https://www.jobstreet.co.id/id/job/85246618?type=standard&ref=search-standalone&origin=jobCard#sol=fea70d688595bcc9728d75a2d8535bc52b95db49;Melakukan analisis lanjutan terhadap insiden yang diekskalasi oleh Security Analyst Level 1. Validasi dan mitigasi insiden. Melakukan koordinasi dengan Security Analyst Level 3 atau Incident Response Team jika diperlukan. Secara proaktif mencari ancaman yang belum terdeteksi oleh sistem otomatis. Menganalisis pola perilaku mencurigakan di dalam jaringan dan end-point. Menganalisis aset TI (end-point dan perangkat TI lainnya) untuk menemukan adanya kerentanan atau ancaman berdasarkan database threat seperti CVE, CTI. Bekerja sama dengan tim security analyst untuk meningkatkan kemampuan deteksi SOC.
Operation Analyst Officer (Cilincing, Jakarta Utara);PT Puninar Jaya;Cilincing, Jakarta Raya;N/A;Full time;6;https://www.jobstreet.co.id/id/job/85113402?type=standard&ref=search-standalone&origin=jobCard#sol=aad6e675a4d9f9aa30ca03f267176f5369ecedcb;"Job Description:
Monitoring utilisasi unit 
truck
 dan 
driver
 dari Pool
Monitoring pemakaian luas warehouse (
indoor
 dan 
outdoor
)
Monitoring 
revenue
 & 
cost Operation
 
by
 Pool & BG
Membuat 
control
 
chart order monitoring
 
by
 Pool dan Branch
Menyiapkan dan menganalisa data-data jika ada penyimpangan dari FS (
Feasibility Stud
y)/ kontrak yang sudah disepakati dengan 
Customer
Menganalisa setiap 
control chart
 (
on time delivery, lead time,
 utilisasi) Operation untuk memperbaiki proses internal Operation
Menyiapkan data 
lead time
 (data yang diperoleh dari CMT) untuk kebutuhan 
Accounting
Membuat 
control chart daily report
 berdasarkan SLA
Melakukan pengukuran SLA berdasarkan standar Puninar
Mempersiapkan bahan review operation (KPI dan issue operational) All Dept. Operation untuk management report
Spesial project untuk analisa data operation sesuai kebutuhan BOD
Tingkat Pendidikan & Pengalaman:
Maksimal 27 tahun
S1 Diutamakan Jurusan Teknik Industri/Akuntansi
Fresh graduate
 atau pengalaman maksimal 2 tahun data analyst atau logistic
Bersedia ditempatkan di Cilincing, Jakarta Utara
 
Pengetahuan & Ketrampilan:
Mempunyai kemampuan analisa data, dan memecahkan masalah & kemampuan presentasi yang baik
Bisa mengoperasikan komputer dengan baik & terbiasa bekerja dengan Ms Office: Ms. Excell, Power Point, Word
Memiliki kemampuan dalam pengaturan administrasi dan dokumentasi dengan baik Memiliki kemampuan 
Problem Solving
Memiliki kemampuan berpikir analis dan logis"
IT Database Administrator Analyst;PT Wahana Duta Jaya Rucika;Gambir, Jakarta Raya;N/A;Kontrak/Temporer;4;https://www.jobstreet.co.id/id/job/85190152?type=standard&ref=search-standalone&origin=jobCard#sol=81b332934906daba207d0097507b7fc0a658c097;"Job Description:
• Mengkonfigurasi dan mengelola sistem manajemen basis data seperti MS SQL Server, My SQL, Postgre SQL (direkomendasikan berpengalaman di MS SQL Server)
• Memantau kinerja basis data, mengidentifikasi masalah, mengoptimalkan query serta penggunaan sumber daya atau peformance 
• Membuat dan mengelola berbagai cadangan atau backup database serta rencana pemulihan bencana atau restore
• Berpengalaman dalam implementasi keamanan dan integritas database seperti menerapkan patching, kontrol akses, enkripsidan prosedur pemantauan
• Berkolaborasi dengan tim pengembang aplikasi untuk memenuhi persyaratan data untuk kegiatan deployment production
• Mengembangkan dan menerapkan prosedur operasional standar untuk pengelolaan database
Qualification:
• S1 Ilmu Komputer / Sistem Informasi / bidang terkait
• Minimal 3-5 tahun pengalaman sbg IT Database Administrator
• Mampu bekerja dibawah tekanan, teroganizir dan self motivated
• Penempatan di Jakarta, tapi memungkinkan untuk menuju area lain di seluruh bisnis unit untuk keperluan visit/proyek"
Sales Data Analyst;PT Eka Bogainti;Jakarta Timur, Jakarta Raya;N/A;Full time;16;https://www.jobstreet.co.id/id/job/84909433?type=standard&ref=search-standalone&origin=jobCard#sol=11c5c68769c161ba37133f5dfe1c3dd1594343c7;"Job Description :
Performing analysis to assess quality and meaning of data
Developing data in a readable format
Identify, analyze, and interpret patterns and trends in complex data sets that could be helpful for the diagnosis and prediction of a successful marketing programs
Requirements :
Candidate must possess at least Bachelor's Degree in any major (preferably Math, Economics, Statistic).
At least 2 Year of working experience in the related field
Proficiency in Ms. Excell
Great data analytics skills
Willing to placement at Ciracas, East Jakarta"
Master Data Management Intern;Danone Indonesia;Jakarta Selatan, Jakarta Raya;N/A;Kontrak/Temporer;4;https://www.jobstreet.co.id/id/job/85184173?type=standard&ref=search-standalone&origin=jobCard#sol=05a930102d56bf185f5f8fdcfb4db36dc375b6f0;"We are seeking a highly motivated and organized active student to join our team as a Master Data Intern. This is a temporary clerical position focused on supporting the successful implementation of our new System. In this role, you will play a vital part in ensuring the accuracy and completeness of our master data.
Responsibilities:
Assist with the creation, update, and maintenance of master data within the system.
Follow up on data requests submitted through several systems.
Liaise with internal stakeholders to gather and clarify data requirements.
Perform data quality checks and identify inconsistencies.
Document processes and procedures related to master data management.
Maintain clear and concise records of all activities.
Qualifications:
Only for Undergraduate Students, from any major
Strong proficiency in Microsoft Excel, including data analysis.
Prior experience with data management or document management systems.
Demonstrated understanding of the English language (written and verbal).
Ability to learn new software and adapt to changing priorities.
Strong attention to detail and a commitment to accuracy.
Ability to work independently and as part of a team."
Data Analyst Staff;PT Perindustrian Bapak Djenggot (Orang Tua Group);Jakarta Barat, Jakarta Raya;N/A;Full time;27;https://www.jobstreet.co.id/id/job/84645827?type=standard&ref=search-standalone&origin=jobCard#sol=abf821c70818c31b3372b14728c67e6dea550a05;"Qualifications:
Bachelor's degree in Statistic, Mathematics, Information System, or Industrial Engineering
Minimum GPA of 3.00
Proficient in Microsoft Office especially 
Microsoft Excel
Willing to be placed in 
Jakarta Barat
Job Description:
Interpret and analyze data using statistical techniques
Provide reports to meet information needs"
Marketing Analyst;PT Garuda Metalindo;Jakarta Utara, Jakarta Raya;N/A;Full time;13;https://www.jobstreet.co.id/id/job/84947390?type=standard&ref=search-standalone&origin=jobCard#sol=040d5d9d55b4c574b06be43e5dd822f9498d9757;"Job Description
We are looking for a 
Marketing Pricing Analyst
 to join our commercial team. This role is crucial in driving the company’s profitability through strategic pricing, market analysis, and collaboration with internal stakeholders.
Responsibilities
Conduct market and competitor pricing analysis to identify trends and opportunities
Develop and maintain product pricing structures aligned with market dynamics and company objectives
Collaborate with Sales, Finance, and Product teams to ensure pricing strategies support business goals
Monitor cost structures and analyze the impact of pricing on margin and revenue
Provide data-driven recommendations for pricing adjustments or promotions
Support commercial decision-making through pricing simulations and reports
Requirements
Bachelor’s degree in Marketing, Economics, Statistics, Industrial Engineering, or a related field
Proven analytical and numerical skills with proficiency in Excel (Pivot Tables, VLOOKUP, etc.) and data tools (e.g., Power BI)
Strong business sense with an understanding of pricing models and market behavior
Excellent communication and interpersonal skills
Detail-oriented, proactive, and able to manage multiple priorities"
Credit Analyst - Jakarta;PT Toyota Astra Financial Services;Jakarta Raya;N/A;Full time;20;https://www.jobstreet.co.id/id/job/84803521?type=standard&ref=search-standalone&origin=jobCard#sol=4b41eff7ec5428be959063696e35cd342d6e7a2a;"Deskripsi Pekerjaan:
Menganalisa setiap aplikasi yang masuk berdasarkan data atau informasi yang diterima, serta mencari informasi lain baik dari lembaga pembiayaan atau media lainnya untuk mendukung target penjualan dengan potensi kerugian yang minimal.
Memberikan rekomendasi berdasarkan hasil analisa kredit untuk memberikan gambaran menyeluruh atas aplikasi kredit.
Memberikan keputusan kredit sesuai kewenangan yang dimiliki untuk mendukung target penjualan dengan potensi kerugian yang minimal.
Memonitor produktivitas, meningkatkan kualitas proses dan hasil analisa kredit untuk mencapai target performa yang ditetapkan.
Memberikan pelayanan kepada pelanggan dan/atau rekan kerja sesuai dengan standar service perusahaan sebagai bagian dari pekerjaan untuk mendukung terciptanya budaya service perusahaan.
Kualifikasi:
Terbuka bagi lulusan baru atau dengan pengalaman kerja 1 tahun
Minimal pendidikan S1, semua jurusan
IPK minimal 3.00/4.00
Teliti, mampu menyelesaikan tugas secara efektif dalam tenggat waktu terbatas, berintegritas tinggi
Kandidat non ex dealer/sales akan diutamakan
Penempatan di Head Office (Gatot Subroto, Jakarta Selatan)"
