Job Position;Company;Location;Salary;Job Type;Days_Since_Posted;Link;Description
Quality Control Data Analyst;PT Kartika Sari Indonesia;Bandung, Jawa Barat;N/A;Full time;3;https://www.jobstreet.co.id/id/job/85200880?type=standard&ref=search-standalone&origin=jobCard#sol=a2442da5fd4a4686257885ead555c04973c439af;"Kualifikasi: 
Minimal pendidikan D4/S1 
Lulusan dari jurusan Sistem Informasi dan Teknik Informatika
Memiliki pengalaman bekerja minimal 1 tahun di bidang QC Data Analyst, atau dibidang serupa. 
Deskripsi Pekerjaan:
Melakukan kegiatan administrasi, penyiapan, pencatatan, dan pengarsipan data, dokumen
Pembuatan laporan dan monitoring aset
Membuat aplikasi pelaporan dan maintenance dashboard
Monitoring dan pencatatan, order perlengkapan CAPEX & OPEX
Pemantauan analisa external di departemen QC"
Financial Institution Ratings Analyst;PT Pemeringkat Efek Indonesia (PEFINDO);Jakarta Selatan, Jakarta Raya;N/A;Full time;5;https://www.jobstreet.co.id/id/job/85154284?type=standard&ref=search-standalone&origin=jobCard#sol=60318eb10d44201ec8fed4bee86e2c69f4b38e30;"Responsibilities:
Responsible for conducting ratings through in-depth analysis of companies (corporate ratings) and/or securities issued within the 
financial services sector
Conduct the rating process for clients and debt instruments in accordance with PEFINDO’s procedures and regulations.
Collect and manage data for clients’ analysis on a regular basis.
Prepare a comprehensive report and rating proposal and make a presentation to the rating committee members.
Monitor the clients’ condition on a regular basis.
Establish and maintain a good, long-term relationship with the clients.
Publish the rating actions to the stakeholders and media.
Prepare articles on sectoral review and relevant issues.
Perform other duties and responsibilities, as assigned.
Requirements:
Min. Bachelor Degree in Accounting/Finance Management,
Graduate from reputable university preferable (Min. GPA 3.00)
Min. 3 years in the financial or non-financial sector and 3 years in the field of credit assessment
Strong understanding of financial institutions and the financial services industry
Candidate with well-known financial analysis certification will be preferred
Excellent in English both verbal & written
Proficient in English report writing
Strong presentation and communication skills
Able to work as a team and meet tight work deadline"
Data Analyst;Altius Hospital;Jakarta Barat, Jakarta Raya;N/A;Full time;5;https://www.jobstreet.co.id/id/job/85135079?type=standard&ref=search-standalone&origin=jobCard#sol=192478e384bbd3694f6b635f76aaffedb3b93d87;"Job Descriptions:
Develop, implement, and maintain leading-edge analytical systems, taking complex problems and building simple frameworks
Identify trends and opportunities for growth through the analysis of complex data sets
Evaluate organizational methods and provide source-to-target mapping and information model specification documents for data sets
Create best practice reports based on data mining, analysis, and visualization
Evaluate internal systems for efficiency, issues, and inaccuracies, and develop and maintain protocols for handling, processing, and cleaning data
Requirements:
Bachelor's degree in Information Systems, Statistics or related major from reputable university with min. 3.00 GPA
Min. 2 years working experience as Revenue Analyst (from Hospital or Hotel background will be an added advantage)
Strong research and analysis skills
Proficient in excel and understand basic SQL server query"
Data Reporting Analyst;PT Wismilak Inti Makmur Tbk;Surabaya, Jawa Timur;N/A;Full time;11;https://www.jobstreet.co.id/id/job/85027148?type=standard&ref=search-standalone&origin=jobCard#sol=e5ea444b948dab05274199782a82b1c17cd3278a;"Sebagai 
Data Reporting Analyst, 
Anda akan bertanggung jawab untuk:
Memenuhi kebutuhan informasi & data di departemen terkait
Checking serta update database / data di aplikasi yang dimiliki oleh departemen
Melakukan analisis data, menyusun rekomendasi / next action dari hasil analisis tersebut serta membuat report secara berkala
Melakukan improvement terhadap pengelolaan data serta penggunaannya di departemen terkait
Kami membutuhkan 
Data Reporting Analyst 
dengan kualifikasi sebagai berikut:
Lulusan D4/S1 Statistika / Matematika / Teknik
Memiliki pengalaman (internship / project / full-time) dalam hal pengolahan serta analisis data
Mampu menggunakan Microsoft Excel / Google Sheet di level Intermediate (Logic & Lookup Function, Pivot Table, Static / Dynamic Chart, Conditional Formatting, Data Validation, dll)
Mampu berkolaborasi dengan pihak lain (dalam/luar departemen) dalam pekerjaannya
Penempatan Surabaya
Bersedia mengikuti proses rekrutmen secara offline apabila diperlukan
Kebutuhan kami ada 2, yakni di Departemen Clinic & Departemen Sales
Notes: Hanya kandidat yang memenuhi kualifikasi yang akan kami proses lebih lanjut."
Analyst Sustainability Strategy;HuntHire;Jakarta Pusat, Jakarta Raya;N/A;Full time;8;https://www.jobstreet.co.id/id/job/85076409?type=standard&ref=search-standalone&origin=jobCard#sol=2a0b18d6ec427243014eebab30028fee3e60ba5b;"We are looking for an 
Analyst Sustainability Strategy
 to join our client company to support the company’s sustainability efforts, especially in reaching Net Zero Emission targets. This role helps plan and monitor sustainability strategies and ensures that environmental and social goals are part of our daily operations.
Key Responsibilities:
Proven work experience in the field of Sustainability and/or Environmental, Social, and Governance (ESG).
Strong understanding of sustainability frameworks, ESG principles, and regulatory requirements.
Experience in developing or supporting sustainability strategies, roadmaps, or reporting.
Familiarity with Net Zero Emission targets and related environmental initiatives.
Requirements:
Proven work experience in the field of Sustainability and/or Environmental, Social, and Governance (ESG).
Bachelor’s degree in Business/Management, Engineering, or Public Health."
Data Engineer (Officer);Dexa Group;Tangerang Selatan, Banten;N/A;Full time;0;https://www.jobstreet.co.id/id/job/85252349?type=standard&ref=search-standalone&origin=jobCard#sol=a05bd554da6d88f3fb43df5a4e9c99e03ebc30ee;"Job Description:
To analyze and validate data source readiness and integrity
To build and organize a data pipeline (ETL/ELT) procedure for usage in a data warehouse environment
Routine work of monitoring and troubleshooting data processing performance
To identify potential problems and create solutions for more robust and efficient data processing
To assess and implement new cloud technology and big data platforms
Requirements :
A Bachelor's Degree in Computer Science, Information Technology, or relevant disciplines from a top university
Minimum 1 year of working experience as a Data Engineer or ETL Developer
Strong analytical skills & high sense of logical thinking
Experience developing data warehouse schemas with OWB, ODI, or other enterprise ETL technologies
Have expertise and experience with a cloud solution, preferably a GCP Platform.
Willing to work onsite & fulltime in Bintaro, Tangerang Selatan"
Data Analyst;PT. MAX AUTO INDONESIA;Surabaya, Jawa Timur;N/A;Kontrak/Temporer;3;https://www.jobstreet.co.id/id/job/85205423?type=standard&ref=search-standalone&origin=jobCard#sol=ec2da739a039a277a100f3ab4b78def03c598892;"Job Desc :
1. Data Collection & Management:
Collect, clean, and organize data related to rental driver activities, fleet usage, and operational metrics.
Maintain and update databases ensuring accuracy and integrity.
 2. Performance Analysis:
Analyze driver performance metrics, including fulfilment rate, online driver performance and earning, and compliance with company policies.
Identify trends and patterns to improve driver efficiency and satisfaction.
 3. Operational Insights:
Evaluate rental trends, peak usage times, and driver availability.
Provide insights to optimize fleet management and rental processes.
 4. Reporting & Visualization:
Create dashboards, reports, and visual presentations for key stakeholders.
Deliver actionable recommendations to improve operational efficiency and revenue.
 5. Collaboration:
Work closely with the operations, finance, and rental support teams to align analytics with business goals.
Support strategic initiatives with data-driven insights.
 6. Problem-Solving:
Monitor and troubleshoot issues related to rental systems, driver data, and customer feedback.
Propose solutions to address operational challenges and enhance service delivery.
 
Requirement :
Maximal age 35 years old
Have experience with the same position min 2 years
Ability to work a team and independently
Excellent Communication and interpersonal skill
Able to operating computer
Responsible and hard worker"
Senior Data Analyst (Risk and Collection);PT Sejahtera Sama Kita;Jakarta Selatan, Jakarta Raya;N/A;Kontrak/Temporer;6;https://www.jobstreet.co.id/id/job/85108414?type=standard&ref=search-standalone&origin=jobCard#sol=92bc3e90c843176776cb0c76248089d129aff1df;"Job Summary
We are seeking a Senior Data Analyst focusing on Collection department to enhance the efficiency and transparency of our collection processes, agent productivity, and vendor-managed collections. This role is responsible for analyzing delinquency trends, tracking agent activities, and optimizing collection strategies—without requiring additional system investments at this stage.
Job Descriptions
:
1. Collection Data Analysis & Performance Tracking
Generate comprehensive reports on collection activities, recovery rates, and aged debt to support management decisions.
Develop manual tracking systems to log agent activity and improve operational visibility.
Conduct deep analysis of collection data to identify trends, inefficiencies, and opportunities for process improvements.
Provide insights on delinquency trends, payment behaviors, and overall collection effectiveness.
Create structured reports and dashboards to assist management in data-driven decision-making.
2. Collection Strategy Optimization
Evaluate and optimize collection processes to improve efficiency and maximize recovery rates.
Assess the effectiveness of different contact strategies, follow-up cadences, and segmentation approaches.
Identify gaps in early delinquency intervention and propose solutions to enhance recoveries.
Recommend enhancements to policies, procedures, and technologies to minimize delinquencies.
Collaborate with risk and operations teams to refine collection policies based on data-driven insights.
3. Vendor Management & Oversight
Establish visibility over third-party collection agents, ensuring full accountability beyond performance results.
Develop a framework for tracking and assessing vendor-managed agents’ activities.
Analyze vendor effectiveness, compliance, and efficiency, providing recommendations for improvement.
Coordinate with external collection agencies or vendors to optimize recovery processes while ensuring compliance with company policies.
Align collection strategies with internal business objectives to enhance overall efficiency.
Requirements
:
Bachelor’s degree in Finance, Business Administration, Economics, Statistics, Data Science, or a related field.
Minimum of 4-7 years in collections, credit risk management, or data analytics within fintech, banking, or financial services.
Proficiency in Excel (pivot tables, advanced formulas) for data manipulation and reporting.
Experience with SQL, Power BI, Tableau, or other data visualization tools for generating reports and insights.
Familiarity with banking-specific CRM systems or other customer relationship management tools.
Experience analyzing large datasets to track payment trends, collections performance, and customer behaviors.
Strong communication skills for preparing reports and coordinating with stakeholders.
Strong analytical and problem-solving skills to identify inefficiencies and recommend improvements.
Ability to manage multiple cases, prioritize tasks, and meet reporting deadlines."
Marketing Analyst;PT Charoen Pokphand Indonesia;Jakarta Raya;N/A;Full time;4;https://www.jobstreet.co.id/id/job/85188301?type=standard&ref=search-standalone&origin=jobCard#sol=fadf4e2395cd50157794808454e28bd6f49bcfa8;"Job Descriptions:
Data collection and analysis - Gather data from multiple sources (e.g. CRM, web analytics, sales, social media), clean and organize data for analysis, use statistical tools to interpret data sets
Market research - Conduct competitor analysis, analyze industry trends, market demands, and customer preferences
Campaign performance tracking - Measure ROI and KPIs of marketing campaigns, identify what’s working and what needs adjustment
Reporting and Insights - Analyze sales dashboards and reports for marketing and leadership teams, translate complex data into actionable recommendations
Customer segmentation - Identify target audiences, help personalize marketing messages based on customer profiles
Forecasting and strategy support - Predict future market trends or customer behavior, support decision-making for product launches, pricing and promotional strategies
Requirements:
Hold min Bachelor’s degree in Computer Science, Information System, Statistics, Marketing, Business or Economics
Has experiences 1 - 3 years in marketing analyst, market research, business intelligence, or a similar role. Preferably has experiences with data analytics in a marketing or digital marketing environment
Technical skills - Analytical tools: Excel advance, Google analytics, SQL, Power BI, Tableau or similar tools, Statistical tools: SPSS, R, Phyton, SAS, familiarity in CRM platforms (e.g. salesforce, HubSpot), knowledge of SEO/SEM, email marketing, or social analytics is a bonus
Strong analytical and critical thinking skills, ability to turn complex data into clear, actionable insights, solid understanding of marketing metrics (ROI, CAC, CLV, conversion rate)
Good communication and presentation skills
Strong attention to detail and accuracy
Work location: Jakarta"
Data Analyst;PT Kalowave Teknologi Indonesia;Jakarta Barat, Jakarta Raya;Rp 5.650.000 – Rp 7.500.000 per month;Full time;6;https://www.jobstreet.co.id/id/job/85121791?type=standard&ref=search-standalone&origin=jobCard#sol=3b2a59cea80c18141d39331a1756730b3ccace9f;"Posisi: Data Analyst – TikTok Shop
Lokasi: Jakarta Barat (Full WFO)
Tipe Pekerjaan: Full-time
Mulai: Segera
Deskripsi Pekerjaan:
Kami mencari seorang Data Analyst penuh waktu yang memiliki pemahaman mendalam tentang sistem kerja TikTok Shop serta mampu mengolah dan menganalisis data e-commerce dengan efisien. Posisi ini bertanggung jawab untuk memberikan wawasan berbasis data guna mendukung pertumbuhan performa toko di TikTok Shop.
Tanggung Jawab:
- Mengumpulkan dan mengelola data dari TikTok Shop.
- Menyusun laporan harian, mingguan, dan bulanan dalam format spreadsheet dan dashboard.
- Menganalisis tren data untuk mendukung tim dalam pengambilan keputusan strategis.
- Berkoordinasi dengan tim internal (konten, operasional, kemitraan) untuk menyelaraskan data dan kemajuan kampanye.
- Menyusun wawasan serta rekomendasi berbasis data untuk meningkatkan performa kampanye.
- Memastikan akurasi dan integritas data.
- Memiliki pengetahuan tentang TikTok Shop.
Kualifikasi:
- Memahami sistem TikTok Shop (pengalaman terkait dengan TikTok Shop lebih diutamakan).
- Menguasai Microsoft Excel dan SQL.
- Memiliki pengalaman minimal 1 tahun di bidang analisis data atau bidang sejenis.
- Mampu mengolah dan menyajikan data dalam bentuk visualisasi sederhana (grafik, dashboard, chart).
- Teliti, rapi, komunikatif, serta mampu bekerja baik dalam tim maupun secara mandiri.
- Mudah beradaptasi dan cepat belajar hal baru.
- Menyukai tantangan.
- Bersedia bekerja full WFO di Jakarta Barat dan dapat mulai segera."
JUNIOR DATA ANALYST;PT Smart Multi Finance;Jakarta Raya;Rp 5.000.000 – Rp 7.000.000 per month;Full time;17;https://www.jobstreet.co.id/id/job/84874081?type=standard&ref=search-standalone&origin=jobCard#sol=48cfb6cfc4d663db1ccf7a678d66eeac9da3b168;"Kami sedang mencari 
Junior Data Analyst
 yang teliti, analitis, dan memiliki kemampuan kuat dalam mengolah data menggunakan 
Microsoft Excel
. Posisi ini cocok untuk kamu yang memiliki ketertarikan terhadap angka, mampu menyajikan data menjadi informasi yang berguna, dan ingin mengembangkan karier di bidang analitik.
Kualifikasi:
Pendidikan minimal S1 dari jurusan Statistik, Matematika, Teknik, Ekonomi, atau jurusan terkait.
Memiliki kemampuan 
lanjutan dalam Microsoft Excel
 (VLOOKUP/XLOOKUP, Pivot Table, IF/SUMIFS, Conditional Formatting, Data Validation, dll).
Mampu mengelola dan membersihkan data (data cleaning).
Memiliki kemampuan analisis dan problem solving yang baik.
Teliti, detail-oriented, dan mampu bekerja dengan data dalam jumlah besar.
Komunikatif dan mampu menyampaikan hasil analisis dalam bentuk yang mudah dipahami.
Pengalaman kerja di bidang analisis data menjadi nilai tambah, namun lulusan baru dipersilakan melamar.
Memahami dasar-dasar Google Sheets dan visualisasi data (misalnya menggunakan grafik Excel).
Penempatan Head Office (BSD-Kelapa Gading)"
Senior Risk Analyst;Doo Group;Jakarta Raya;Rp 10,000,000 – Rp 15,000,000 per month;Full time;0;https://www.jobstreet.co.id/id/job/85255793?type=standard&ref=search-standalone&origin=jobCard#sol=fee888624591bb6aed774eb783d7752b85d07a06;"Join Doo Group – Explore α Better Future
Doo Group
 is a global financial services group with FinTech as its core. With our 10 major business lines, spanning Brokerage, Wealth Management, Property, Payment & Exchange, FinTech, Financial Education, Health Care, Consulting, Cloud, and Digital Marketing, Doo Group has seamlessly provided clients with comprehensive products and services across the world. Through a one-stop approach, Doo Group remains committed to helping our clients achieve an ideal financial life while moving towards a better future together!
 
Looking for a New Challenge? Join Us as We Expand Globally!
As we continue our global business expansion, we’re on the lookout for talented individuals who are motivated to support our strategic goals and initiatives. Join a team that values innovation and growth.
DOO you have what it takes?
 
What you’ll be working on:
Monitor daily, weekly, and monthly client profitability, equity, margin figures and market data.
Performing risk assessment and evaluation of the company exposure to the market.
Monitor, analyse and limit the probability of a financial loss or exposures to financial uncertainty with ability to employ hedging strategies.
Monitor clients' trading activities and patterns to identify any potential abusive behaviour i.e arbitraging, as well as building, enhancing and developing systems to mitigate and prevent such behaviour.
Develop and maintain risk reporting and analysis tools to provide senior management with timely and accurate information on risk levels and trends.
Measure the impact of new features, systems, and procedures by conducting quantitative and qualitative analysis.
Keep abreast of the latest regulatory developments and best practices regarding risk management, market-making, and trading.
Assist in the development of risk management tools, reports, and systems.
Collaborate with trading, compliance, and technology teams to identify potential risks and implement measures to mitigate the risks.
Provide training and guidance to junior team members on risk management best practices.
 
What we’re looking for:
University degree in a quantitative field (such as finance, mathematics, statistics, or physics) or equivalent in training and experience.
Min 3 years of experience in Risk Management in a similar industry.
Working experience with
 trading platforms
 both as user and administrator on MT4/5, bridging technology such as One Zero and PrimeXM and other relevant risk management tools.
Strong quantitative and data analytical skills
 with knowledge of Excel and Macros.
Knowledge of any programming languages such Python, SQL, and C++,as an added advantage.
In-depth understanding of financial instruments and markets, including 
FX, futures, stocks, and stock indices
.
Able to work on rotational shifts
 (morning and evening shift).
Excellent spoken and written 
English skills
.
 
Life as DOOers
At Doo Group, we embrace a culture where continuous growth, collaboration, and creativity are at the heart of everything we do. As a DOO, you'll collaborate with top professionals from around the globe, dive into exciting projects, and play a pivotal role in shaping the future of finance.
Unlock your potential with Doo Group. Apply now and step into a role where your impact is celebrated!
Discover your potential with Doo Group. Apply now and be part of our success story!
#DooBeyondLimit #TogetherWeDooMore #SucceedYourCareerWithDoo"
Data Analyst;PT Dinus Cipta Mandiri;Jakarta Barat, Jakarta Raya;Rp 6.000.000 – Rp 8.000.000 per month;Kontrak/Temporer;7;https://www.jobstreet.co.id/id/job/84664778?type=standard&ref=search-standalone&origin=jobCard#sol=0acdf8b4ddcb400015de814b4633bbdd8d3e3ba7;"Job requirements:
Max 35 years
Bachelor/Master's degree majoring in Statistics, Mathematics, Physics, Computers/Informatics, Engineering
Proficiency in Excel
Experience in using SQL
Experience with statistical analysis and data mining
Strong analytical and problem solving skills including ability to independently drive analysis concluding with rationalized recommendations
Strong communications skills for both technical and business purposes
Have knowledge of distribution systems
Fluent in English
 
Job Description:
Analyzing data related to sales, purchasing, distribution
Create reports and provide the data needed to help decision makers
Work closely with the marketing team to determine metrics to measure the success of business performance & achieve goals
Conduct cause-effect analysis to evaluate the effectiveness of various marketing initiatives
Manage the distribution of goods"
Data Analyst;PT Propan Raya Industrial Coating Chemicals;Tangerang, Banten;N/A;Full time;6;https://www.jobstreet.co.id/id/job/85102118?type=standard&ref=search-standalone&origin=jobCard#sol=7ffe26278dc50b467d9e7fb5b671f3f349c6adb4;"Job Description:
Menganalisis data untuk mengidentifikasi tren, korelasi, dan insight bisnis
Mengembangkan laporan, visualisasi data, dan dashboard interaktif
Memberikan rekomendasi berbasis data kepada stakeholder terkait
Berkolaborasi dengan tim lintas fungsi untuk memahami kebutuhan analitik
Requirements:
Lulusan S1 Statistika, Matematika, atau Akuntansi
Menguasai Microsoft Excel secara mendalam (termasuk fungsi lanjutan dan analisis data)
Kemampuan komunikasi dan kolaborasi yang solid
Adaptif dalam kerja individu maupun tim
Pengalaman 1–2 tahun sebagai Data Analyst dengan pemahaman analitik yang kuat"
System Analyst;PT Pranala Ragam Karya;Kecamatan Tangerang, Banten;Rp 6.000.000 – Rp 8.000.000 per month;Full time;4;https://www.jobstreet.co.id/id/job/85166406?type=standard&ref=search-standalone&origin=jobCard#sol=1243b86c15c40f4fc9bc21e58c33e657518127a5;"Requirment
1. Berpengalaman dalam bidang system analyst max selama 3 tahun
2. Pendidikan S1 IT akan leih baik karena harus memahami patter patter bahasa pemrograman
3. Dapat membuat ERD
Terbiasa melakukan optimasi Database terutama postgres dan my sql
5. bisa membuat dokumen teknis
6. Dapat membuat digaram system (DFD/UML) 
Selain dari ke 6 di atas, point point di bawah ini juga masuk di dalam kriteria yang di butuhkan
1. Aktif dalam bermomunikasi dengan Bahasa Inggris
Dapat berkomukasi dengan klien
3. Dapat membuat timeline
4. Dapat mengatur penggunanaan project management ex: trello
5. Memiliki analisys yang baik dalam suatu project"
Data Support (Jabar - Bandung);PT Depoguna Bangunan Online;Bandung, Jawa Barat;N/A;Full time;18;https://www.jobstreet.co.id/id/job/84867376?type=standard&ref=search-standalone&origin=jobCard#sol=969eae64f4a37d8e3791417bbb0073d43b769564;"Kualifikasi:
Berpengalaman min. 2 th di bidang Project support, terbiasa memahami proses yang berjalan.
Berpengalaman melakukan support pelaksanaan project mulai dari data setting, mapping data, pengecekan integrasi data ke system sampai dengan sosialisasi event terlaksana.
Berpengalaman dalam menangani masalah dan perubahan-perubahan yang terkait dengan aktivitasnya secara tepat sehingga isu-isu yang ada tersebut dapat terselesaikan.
Berpengalaman dalam melakukan monitoring terhadap fitur/proses yang berjalan pada project.
Terbiasa dalam menyediakan laporan-laporan terkait yang dibutuhkan oleh manajemen."
